{
  "apiVersion": "ontology.specgraph.io/snapshot-authority/v1alpha1",
  "confirmations": [
    {
      "authorityKey": "fixture-operator",
      "originId": "claimed-before-origin",
      "rationale": "Explicit synthetic complete finite-state origin confirmation; not factual truth.",
      "snapshotId": "claimed-before"
    },
    {
      "authorityKey": "fixture-operator",
      "originId": "claimed-after-origin",
      "rationale": "Explicit synthetic complete finite-state origin confirmation; not factual truth.",
      "snapshotId": "claimed-after"
    }
  ],
  "enrichments": [
    {
      "authorityKey": "fixture-operator",
      "candidateId": "reported",
      "rationale": "Explicit admission of this synthetic candidate-record link.",
      "recordId": "claimed-record"
    }
  ],
  "grants": [
    {
      "authorityKey": "fixture-operator",
      "capabilities": [
        "confirm-source",
        "enrich-candidate"
      ],
      "projectionKeys": [
        "claimed-physical"
      ],
      "scopeKeys": [
        "episode-1"
      ]
    }
  ],
  "graphKey": "unproven-empty-enrichment",
  "graphSHA256": "52f065b60576068a0e1a7034977e1a1c1a040eaf24fd451c8d6f5849dca06b59",
  "kind": "SnapshotProvenanceAuthority",
  "profilePin": {
    "definitionSHA256": "240d518666905c320df299b5d4d9e08e7c2564b0ca97ca2ab15d0a275dbe2551",
    "id": "eventcore-provenance-v1",
    "version": "1.0.0"
  },
  "revisionKey": "r1"
}
