{
  "apiVersion": "ontology.specgraph.io/snapshot-authority/v1alpha1",
  "confirmations": [],
  "enrichments": [
    {
      "authorityKey": "fixture-operator",
      "candidateId": "reported",
      "rationale": "Explicit admission of this synthetic candidate-record link.",
      "recordId": "claimed-record"
    }
  ],
  "grants": [
    {
      "authorityKey": "fixture-operator",
      "capabilities": [
        "confirm-source",
        "enrich-candidate"
      ],
      "projectionKeys": [
        "claimed-physical"
      ],
      "scopeKeys": [
        "episode-1"
      ]
    }
  ],
  "graphKey": "unproven-empty-enrichment",
  "graphSHA256": "48a8640515ae903e20be69e46e49a1ed3844266c3ed1518eb1e5c6407c33056e",
  "kind": "SnapshotProvenanceAuthority",
  "profilePin": {
    "definitionSHA256": "240d518666905c320df299b5d4d9e08e7c2564b0ca97ca2ab15d0a275dbe2551",
    "id": "eventcore-provenance-v1",
    "version": "1.0.0"
  },
  "revisionKey": "r1"
}
